<?xml version="1.0" encoding="UTF-8"?>
<scene xmlns:xsi="http://www.w3.org/2001/XMLSchema-instance" 
             xsi:noNamespaceSchemaLocation="subscreenSchema.xsd">

<!-- Test purposes
      1) build screen tree hierarchy by subscreen (recursive) insertion
      2) test tag &gt;import&lt;
      3) test symbolic reference to screen building functions defined 
         in imported julia code and mixing with programmatically defined
         stuff.       
      4) test connectors,including adhoc rules and multiple connections
-->
<!-- Function definitions  -->

<julia   modulename="SubScreensModule">
   <import fn="doPlot2D"/>
   <import fn="doPlot3D"/>
</julia>

<!-- Subscreen description -->

 <subscreen rows="2" cols="2" name="MAIN">
  <rowsizes>1,4</rowsizes>
  <colsizes>4,1</colsizes>
  <table>
    <tr>
     <subscreen name="A1"/>
     <subscreen name="A2"/>
     </tr>
    <tr>
     <subscreen name="B1"/>
     <subscreen rows="4" cols="1" name="INNER">
         <rowsizes>1,1,1,1</rowsizes>
         <colsizes>1</colsizes>
         <table>
             <tr><subscreen name="IA1"/></tr>
             <tr><subscreen name="IB1"/></tr>
             <tr><subscreen name="IC1"/></tr>
             <tr><subscreen name="ID1"/></tr>
         </table>
     </subscreen>
    </tr>
   </table>
 </subscreen>


<!-- Subscreen contents -->

 <setplot  ref="A1"  fn="doPlot2D"/>
 <setplot  ref="A2"  fn="doPlot3D"/>
 <setplot  ref="B1"  fn="doPlot2D"/>

 <setplot  ref="IA1"  fn="doPic"/>
 <setplot  ref="IB1"  fn="doPlot3D"> 
      <rotateModel>Pi/5,0.0,0.0</rotateModel>
 </setplot>
 <setplot  ref="IC1"  fn="doPlot3D">
      <rotateModel>0.0, Pi/5,0.0</rotateModel>
 </setplot>
 <setplot  ref="ID1"  fn="doPlot3D">
      <rotateModel>0.0,0.0, Pi/5</rotateModel>
 </setplot>

 <!-- Connectors -->
 <connection from="B1" to="A2"> 
      <inSig>:view  , :adhoc, :projection,    :projectionview, :projection, 
              </inSig> 
       <outSig>:view , :adhoc, :projectionview,:projection,    :projection,
              </outSig> 
 </connection>
 <connection from="B1" to="IB1"> 
      <inSig>:view  , :adhoc, :projection,    :projectionview, :projection, 
              </inSig> 
       <outSig>:view , :adhoc, :projectionview,:projection,    :projection,
              </outSig> 
 </connection>
 <connection from="B1" to="IC1"> 
      <inSig>:view  , :adhoc,  :projection,    :projectionview, :projection, 
              </inSig> 
       <outSig>:view , :adhoc, :projectionview,:projection,    :projection,
              </outSig> 
 </connection>
 <connection from="B1" to="ID1"> 
      <inSig>:view  ,  :adhoc, :projection,    :projectionview, :projection, 
              </inSig> 
       <outSig>:view , :adhoc, :projectionview,:projection,    :projection,
              </outSig> 
 </connection>

 <!-- Debug options -->

<debug>
    <dump ref="IC1"/>
</debug>

</scene>
<!-- This ends the scene-->
